{
  "$schema": "../schemas/data-context-manifest.schema.json",
  "schema_version": "1.0.0",
  "context_manifest_id": "candidate_workflow_context",
  "version": "0.1.0",
  "workflow_id": "candidate_workflow",
  "owner": "data-product-owner",
  "reviewed_at": "2026-08-12T12:00:00Z",
  "decision_scope": "One bounded workflow decision for one eligible segment",
  "status": "draft",
  "data_planes": [
    {
      "plane_id": "operational",
      "owner": "domain-operations",
      "purpose": "Supply current work-item state and source-of-truth identifiers",
      "source_ids": ["system_of_record"],
      "allowed_uses": ["Eligibility and current-state verification"],
      "prohibited_uses": ["Training or unrelated analytics"],
      "retention": "Read at decision time; retain only governed references",
      "training_use": "prohibited"
    },
    {
      "plane_id": "knowledge_context",
      "owner": "policy-owner",
      "purpose": "Supply approved rules and explanatory evidence",
      "source_ids": ["policy_context"],
      "allowed_uses": ["Policy retrieval and cited explanation"],
      "prohibited_uses": ["Granting authority or overriding operational state"],
      "retention": "Cache only to the declared freshness objective",
      "training_use": "prohibited"
    },
    {
      "plane_id": "evaluation_training",
      "owner": "evaluation-owner",
      "purpose": "Evaluate the declared workflow claim on source-bound cases",
      "source_ids": ["evaluation_cases"],
      "allowed_uses": ["Release and regression evaluation"],
      "prohibited_uses": ["Runtime retrieval or answer-key exposure"],
      "retention": "Version with the evaluated release claim",
      "training_use": "explicit_approval_required"
    },
    {
      "plane_id": "telemetry_feedback",
      "owner": "service-owner",
      "purpose": "Measure accepted outcomes, guardrails, data health, and drift",
      "source_ids": ["outcome_events"],
      "allowed_uses": ["Service monitoring and governed regression learning"],
      "prohibited_uses": ["Silent training, labeling, or authority expansion"],
      "retention": "Retain aggregates and governed event references per service policy",
      "training_use": "explicit_approval_required"
    }
  ],
  "sources": [
    {
      "source_id": "system_of_record",
      "planes": ["operational"],
      "location": { "system": "workflow-system", "environment": "target", "interface": "scoped-read-api", "residency": "customer-controlled region" },
      "owner": "domain-operations",
      "source_of_truth": true,
      "purpose": "Current work-item state for eligibility and readback",
      "classification": "confidential",
      "trust": "trusted_data",
      "tenant_binding": true,
      "population": { "definition": "Items admitted to the bounded workflow", "grain": "one row per work item revision", "entity_keys": ["tenant_id", "work_item_id", "source_revision"], "time_semantics": "effective and observed times retained separately", "coverage_segments": ["pilot-segment"] },
      "contract": { "schema_id": "system-of-record-work-item", "version": "0.1.0", "digest": "sha256:7777777777777777777777777777777777777777777777777777777777777777", "revision": "record-revision-required", "freshness_slo_seconds": 300 },
      "access": { "principals": ["workflow-reader"], "row_scope": "Current tenant and admitted segment", "field_scope": "Minimum fields required by the decision", "purpose_limit": "Bounded workflow decision only", "retention": "Identifiers and cited fields for the release audit window", "deletion": "Delete derived copies when the engagement or retention window ends" },
      "quality": { "profiled_at": "2026-08-12T12:00:00Z", "method": "Replace with the reproducible profile query and sample frame", "sample_size": 1, "metrics": [{ "dimension": "completeness", "unit": "fraction", "threshold_operator": ">=", "threshold": 0.99, "observed": null, "status": "unknown", "evidence": "Profile not yet executed" }] },
      "failure_behavior": { "missing": "Stop and route to the workflow owner", "stale": "Refresh from source before deciding", "conflicting": "Prefer the source of truth and record the conflict", "corrected": "Invalidate derived context and replay affected cases", "late_arriving": "Hold the item until the declared reconciliation window closes" }
    },
    {
      "source_id": "policy_context",
      "planes": ["knowledge_context"],
      "location": { "system": "policy-repository", "environment": "target", "interface": "versioned-document-api", "residency": "customer-controlled region" },
      "owner": "policy-owner",
      "source_of_truth": true,
      "purpose": "Approved rules and interpretation guidance",
      "classification": "internal",
      "trust": "trusted_control",
      "tenant_binding": true,
      "population": { "definition": "Policies effective for the admitted segment", "grain": "one policy revision", "entity_keys": ["policy_id", "policy_revision"], "time_semantics": "effective-from and superseded-at", "coverage_segments": ["pilot-segment"] },
      "contract": { "schema_id": "policy-record", "version": "1.0.0", "digest": "sha256:8888888888888888888888888888888888888888888888888888888888888888", "revision": "replace-with-approved-policy-revision", "freshness_slo_seconds": 3600 },
      "access": { "principals": ["policy-reader"], "row_scope": "Policies for the admitted tenant and segment", "field_scope": "Approved policy content and metadata", "purpose_limit": "Decision support and cited explanation", "retention": "Version-bound cache only", "deletion": "Invalidate and delete superseded cached content" },
      "quality": { "profiled_at": "2026-08-12T12:00:00Z", "method": "Replace with policy coverage and revision audit", "sample_size": 1, "metrics": [{ "dimension": "coverage", "unit": "fraction", "threshold_operator": "=", "threshold": 1, "observed": null, "status": "unknown", "evidence": "Coverage audit not yet executed" }] },
      "failure_behavior": { "missing": "Do not infer policy; escalate", "stale": "Retrieve the current effective revision", "conflicting": "Stop for policy-owner adjudication", "corrected": "Invalidate cached policy and rerun affected decisions", "late_arriving": "Apply only after effective time and release review" }
    },
    {
      "source_id": "evaluation_cases",
      "planes": ["evaluation_training"],
      "location": { "system": "evaluation-repository", "environment": "isolated-evaluation", "interface": "versioned-fixture-bundle", "residency": "approved evaluation environment" },
      "owner": "evaluation-owner",
      "source_of_truth": true,
      "purpose": "Representative release and regression cases",
      "classification": "confidential",
      "trust": "trusted_data",
      "tenant_binding": true,
      "population": { "definition": "Adjudicated cases sampled from the eligible population and failure history", "grain": "one immutable case revision", "entity_keys": ["case_id", "case_revision"], "time_semantics": "case observation and adjudication time", "coverage_segments": ["pilot-segment", "known-failures"] },
      "contract": { "schema_id": "evaluation-case", "version": "1.0.0", "digest": "sha256:9999999999999999999999999999999999999999999999999999999999999999", "revision": "replace-with-suite-digest", "freshness_slo_seconds": 604800 },
      "access": { "principals": ["isolated-evaluator"], "row_scope": "Approved evaluation suite", "field_scope": "Sanitized case inputs and protected expected results", "purpose_limit": "Evaluation only", "retention": "Preserve with release evidence", "deletion": "Follow source-data deletion and case-retirement policy" },
      "quality": { "profiled_at": "2026-08-12T12:00:00Z", "method": "Replace with coverage, label, contamination, and leakage audit", "sample_size": 1, "metrics": [{ "dimension": "representativeness", "unit": "review-status", "threshold_operator": "=", "threshold": 1, "observed": null, "status": "unknown", "evidence": "Suite review not yet complete" }] },
      "failure_behavior": { "missing": "Block release evidence", "stale": "Review population and failure slices before reuse", "conflicting": "Adjudicate labels independently", "corrected": "Version the case; preserve prior evidence", "late_arriving": "Add to the next owned regression cycle" }
    },
    {
      "source_id": "outcome_events",
      "planes": ["telemetry_feedback"],
      "location": { "system": "service-telemetry", "environment": "target", "interface": "governed-event-stream", "residency": "customer-controlled region" },
      "owner": "service-owner",
      "source_of_truth": false,
      "purpose": "Outcome, guardrail, adoption, cost, and data-health measurement",
      "classification": "confidential",
      "trust": "trusted_data",
      "tenant_binding": true,
      "population": { "definition": "Every admitted run and linked verified outcome", "grain": "one immutable event", "entity_keys": ["tenant_hash", "run_id", "operation_id"], "time_semantics": "event, observed, and verified times", "coverage_segments": ["pilot-segment"] },
      "contract": { "schema_id": "outcome-event", "version": "1.0.0", "digest": "sha256:aaaaaaaaaaaaaaaaaaaaaaaaaaaaaaaaaaaaaaaaaaaaaaaaaaaaaaaaaaaaaaaa", "revision": "replace-with-event-contract-digest", "freshness_slo_seconds": 300 },
      "access": { "principals": ["telemetry-writer", "service-reviewer"], "row_scope": "Current tenant and admitted release", "field_scope": "Allowlisted identifiers, measures, and stop reasons", "purpose_limit": "Operations and governed learning", "retention": "Per service telemetry policy", "deletion": "Delete or aggregate at retention expiry" },